{
 "schema_version": "human-label-v1",
 "record_id": "v2-math-44a53543d48fba20",
 "arm": "math",
 "content_sha256": "f05aac8d1e1d0c3b:c9e456e2bc4b0db6",
 "labeler_id": "labeler-a",
 "labeled_at": "2026-09-17T17:19:30.848655+00:00",
 "criteria_version": "phase2-calibration-v1",
 "reference_version": "taxonomy_reference_v1",
 "blinded_to_jev": true,
 "labels": {
  "correctness": "yes",
  "problematic": "no",
  "category_correct": "yes"
 },
 "notes": ""
}
