{
 "schema_version": "human-label-v1",
 "record_id": "v2-systems-p1-y9-linux-kernel_553c7d5ba2fe64cdbfcdf49560ef71ef",
 "arm": "systems",
 "content_sha256": "f51ca8508188aa68:14cb79d72b5846bc",
 "labeler_id": "labeler-a",
 "labeled_at": "2026-09-17T17:19:30.857331+00:00",
 "criteria_version": "phase2-calibration-v1",
 "reference_version": "taxonomy_reference_v1",
 "blinded_to_jev": true,
 "labels": {
  "correctness": "yes",
  "problematic": "no",
  "category_correct": "yes"
 },
 "notes": ""
}
