{
 "schema_version": "human-label-v1",
 "record_id": "v2-code-49fd89641436b479",
 "arm": "code",
 "content_sha256": "938971021e89cd88:57a810467af331eb",
 "labeler_id": "labeler-a",
 "labeled_at": "2026-09-17T15:37:38.281229+00:00",
 "criteria_version": "phase2-calibration-v1",
 "reference_version": "taxonomy_reference_v1",
 "blinded_to_jev": true,
 "labels": {
  "correctness": "yes",
  "problematic": "no",
  "category_correct": "yes"
 },
 "notes": ""
}
