{
 "schema_version": "human-label-v1",
 "record_id": "v2-systems-p1-y9-linux-kernel_597aa16c782496bf74c5dc3b45ff472a",
 "arm": "systems",
 "content_sha256": "1c83b01f036369c4:96adce9e66a45efe",
 "labeler_id": "labeler-a",
 "labeled_at": "2026-09-17T17:19:30.857657+00:00",
 "criteria_version": "phase2-calibration-v1",
 "reference_version": "taxonomy_reference_v1",
 "blinded_to_jev": true,
 "labels": {
  "correctness": "yes",
  "problematic": "no",
  "category_correct": "yes"
 },
 "notes": ""
}
