{
 "schema_version": "human-label-v1",
 "record_id": "v2-systems-p1-y9-linux-kernel_40767b0dc768060266d261b4a330164b",
 "arm": "systems",
 "content_sha256": "47405ccbb043fb6d:57b8409b9e6ec6f5",
 "labeler_id": "labeler-a",
 "labeled_at": "2026-09-17T17:19:30.856658+00:00",
 "criteria_version": "phase2-calibration-v1",
 "reference_version": "taxonomy_reference_v1",
 "blinded_to_jev": true,
 "labels": {
  "correctness": "yes",
  "problematic": "no",
  "category_correct": "yes"
 },
 "notes": ""
}
