{
 "schema_version": "human-label-v1",
 "record_id": "v2-math-e7600473cff0f5ae",
 "arm": "math",
 "content_sha256": "1cc0dfd5b05f5538:3027ec5dd0c1ec9e",
 "labeler_id": "labeler-a",
 "labeled_at": "2026-09-17T17:19:30.854763+00:00",
 "criteria_version": "phase2-calibration-v1",
 "reference_version": "taxonomy_reference_v1",
 "blinded_to_jev": true,
 "labels": {
  "correctness": "yes",
  "problematic": "no",
  "category_correct": "yes"
 },
 "notes": ""
}
