{
 "schema_version": "human-label-v1",
 "record_id": "v2-general-082d0cb3ffbd78b9",
 "arm": "general",
 "content_sha256": "175ae8bb33947daf:d9919fc7662b55d3",
 "labeler_id": "labeler-a",
 "labeled_at": "2026-09-17T15:48:20.136628+00:00",
 "criteria_version": "phase2-calibration-v1",
 "reference_version": "taxonomy_reference_v1",
 "blinded_to_jev": true,
 "labels": {
  "correctness": "yes",
  "problematic": "no",
  "category_correct": "yes"
 },
 "notes": ""
}
