{
 "schema_version": "human-label-v1",
 "record_id": "v2-math-382cef51b5ff9276",
 "arm": "math",
 "content_sha256": "73ec3ab3327f1ae9:d65931acf8641e09",
 "labeler_id": "labeler-a",
 "labeled_at": "2026-09-17T17:19:30.847964+00:00",
 "criteria_version": "phase2-calibration-v1",
 "reference_version": "taxonomy_reference_v1",
 "blinded_to_jev": true,
 "labels": {
  "correctness": "yes",
  "problematic": "no",
  "category_correct": "yes"
 },
 "notes": ""
}
