{
 "schema_version": "human-label-v1",
 "record_id": "v2-general-ba8da6eb3ddfdb36",
 "arm": "general",
 "content_sha256": "08003fdc8b6d0912:f7402dead346c5d7",
 "labeler_id": "labeler-b",
 "labeled_at": "2026-09-17T17:26:00.522970+00:00",
 "criteria_version": "phase2-calibration-v1",
 "reference_version": "taxonomy_reference_v1",
 "blinded_to_jev": true,
 "labels": {
  "correctness": "yes",
  "problematic": "no",
  "category_correct": "yes"
 },
 "notes": "Provenance: judgments relayed via operator; second human states direct blinded review of all 84 records. See STATUS.md."
}
