{
 "schema_version": "human-label-v1",
 "record_id": "v2-math-2eca69760d4b6413",
 "arm": "math",
 "content_sha256": "86c91e0c93251a3b:a88e9ace69b01411",
 "labeler_id": "labeler-b",
 "labeled_at": "2026-09-17T17:26:00.527033+00:00",
 "criteria_version": "phase2-calibration-v1",
 "reference_version": "taxonomy_reference_v1",
 "blinded_to_jev": true,
 "labels": {
  "correctness": "yes",
  "problematic": "no",
  "category_correct": "yes"
 },
 "notes": "Provenance: judgments relayed via operator; second human states direct blinded review of all 84 records. See STATUS.md."
}
