{
 "schema_version": "human-label-v1",
 "record_id": "v2-math-e3e6d4f5623e85f9",
 "arm": "math",
 "content_sha256": "1874e7a1c27bcc7b:22245cf72a3d5b1c",
 "labeler_id": "labeler-a",
 "labeled_at": "2026-09-17T17:19:30.854447+00:00",
 "criteria_version": "phase2-calibration-v1",
 "reference_version": "taxonomy_reference_v1",
 "blinded_to_jev": true,
 "labels": {
  "correctness": "yes",
  "problematic": "no",
  "category_correct": "yes"
 },
 "notes": ""
}
