{
 "schema_version": "human-label-v1",
 "record_id": "v2-code-b622be913aee458f",
 "arm": "code",
 "content_sha256": "70c79d6da0284ce8:b720439fe90e5673",
 "labeler_id": "labeler-a",
 "labeled_at": "2026-09-17T15:40:30.103390+00:00",
 "criteria_version": "phase2-calibration-v1",
 "reference_version": "taxonomy_reference_v1",
 "blinded_to_jev": true,
 "labels": {
  "correctness": "yes",
  "problematic": "no",
  "category_correct": "yes"
 },
 "notes": ""
}
