{
 "schema_version": "human-label-v1",
 "record_id": "v2-math-36b99a746186d743",
 "arm": "math",
 "content_sha256": "0ded786c182c4549:dfaf711b7cc7f908",
 "labeler_id": "labeler-b",
 "labeled_at": "2026-09-17T17:26:00.528039+00:00",
 "criteria_version": "phase2-calibration-v1",
 "reference_version": "taxonomy_reference_v1",
 "blinded_to_jev": true,
 "labels": {
  "correctness": "yes",
  "problematic": "no",
  "category_correct": "yes"
 },
 "notes": "Provenance: judgments relayed via operator; second human states direct blinded review of all 84 records. See STATUS.md."
}
