{
 "schema_version": "human-label-v1",
 "record_id": "v2-code-ec07a971a6a0a235",
 "arm": "code",
 "content_sha256": "2260a8491280312f:1d2160f01959bb4e",
 "labeler_id": "labeler-b",
 "labeled_at": "2026-09-17T17:26:00.515494+00:00",
 "criteria_version": "phase2-calibration-v1",
 "reference_version": "taxonomy_reference_v1",
 "blinded_to_jev": true,
 "labels": {
  "correctness": "yes",
  "problematic": "no",
  "category_correct": "yes"
 },
 "notes": "Provenance: judgments relayed via operator; second human states direct blinded review of all 84 records. See STATUS.md."
}
