{
 "schema_version": "human-label-v1",
 "record_id": "v2-code-f2f3334354fa2bb4",
 "arm": "code",
 "content_sha256": "1a82e3a4fcebb5f0:1112300429f02c45",
 "labeler_id": "labeler-b",
 "labeled_at": "2026-09-17T17:26:00.516455+00:00",
 "criteria_version": "phase2-calibration-v1",
 "reference_version": "taxonomy_reference_v1",
 "blinded_to_jev": true,
 "labels": {
  "correctness": "yes",
  "problematic": "no",
  "category_correct": "yes"
 },
 "notes": "Provenance: judgments relayed via operator; second human states direct blinded review of all 84 records. See STATUS.md."
}
