{
 "schema_version": "human-label-v1",
 "record_id": "v2-code-40c9f863bd63c43f",
 "arm": "code",
 "content_sha256": "f86e27ce1f598af9:ca103b1d37b3bb14",
 "labeler_id": "labeler-b",
 "labeled_at": "2026-09-17T17:26:00.512587+00:00",
 "criteria_version": "phase2-calibration-v1",
 "reference_version": "taxonomy_reference_v1",
 "blinded_to_jev": true,
 "labels": {
  "correctness": "yes",
  "problematic": "no",
  "category_correct": "yes"
 },
 "notes": "Provenance: judgments relayed via operator; second human states direct blinded review of all 84 records. See STATUS.md."
}
