{
 "schema_version": "human-label-v1",
 "record_id": "v2-general-896084c346593174",
 "arm": "general",
 "content_sha256": "2563cdee2682870c:039d06ff74019b21",
 "labeler_id": "labeler-b",
 "labeled_at": "2026-09-17T17:26:00.520466+00:00",
 "criteria_version": "phase2-calibration-v1",
 "reference_version": "taxonomy_reference_v1",
 "blinded_to_jev": true,
 "labels": {
  "correctness": "yes",
  "problematic": "no",
  "category_correct": "yes"
 },
 "notes": "Provenance: judgments relayed via operator; second human states direct blinded review of all 84 records. See STATUS.md."
}
