{
 "schema_version": "human-label-v1",
 "record_id": "v2-math-380200a3c7bfc8d8",
 "arm": "math",
 "content_sha256": "f7ca006d415d0fc4:32b36f459f1e9d30",
 "labeler_id": "labeler-b",
 "labeled_at": "2026-09-17T17:26:00.528451+00:00",
 "criteria_version": "phase2-calibration-v1",
 "reference_version": "taxonomy_reference_v1",
 "blinded_to_jev": true,
 "labels": {
  "correctness": "yes",
  "problematic": "no",
  "category_correct": "yes"
 },
 "notes": "Provenance: judgments relayed via operator; second human states direct blinded review of all 84 records. See STATUS.md."
}
