{
 "schema_version": "human-label-v1",
 "record_id": "v2-math-481f44ccaed1a261",
 "arm": "math",
 "content_sha256": "401330949586efe9:3c16e1049d5cd156",
 "labeler_id": "labeler-a",
 "labeled_at": "2026-09-17T17:19:30.848973+00:00",
 "criteria_version": "phase2-calibration-v1",
 "reference_version": "taxonomy_reference_v1",
 "blinded_to_jev": true,
 "labels": {
  "correctness": "yes",
  "problematic": "no",
  "category_correct": "yes"
 },
 "notes": ""
}
