{
 "schema_version": "human-label-v1",
 "record_id": "v2-code-f1f9c3b367a7f5f8",
 "arm": "code",
 "content_sha256": "9ab38d31087d297d:32bbca94cff00471",
 "labeler_id": "labeler-b",
 "labeled_at": "2026-09-17T17:26:00.516127+00:00",
 "criteria_version": "phase2-calibration-v1",
 "reference_version": "taxonomy_reference_v1",
 "blinded_to_jev": true,
 "labels": {
  "correctness": "yes",
  "problematic": "no",
  "category_correct": "yes"
 },
 "notes": "Provenance: judgments relayed via operator; second human states direct blinded review of all 84 records. See STATUS.md."
}
